{
  "$schema": "https://json-schema.org/draft/2020-12/schema",
  "$id": "https://agenthook.org/envelope.schema.json",
  "title": "AgentHook Event Envelope",
  "description": "JSON Schema for the AgentHook event envelope, SPEC v0.2 section 1.",
  "type": "object",
  "required": [
    "event_id",
    "event_type",
    "timestamp",
    "source"
  ],
  "properties": {
    "schema_version": {
      "type": "integer",
      "default": 1,
      "description": "Wire-format version. Bumped only on breaking envelope changes."
    },
    "event_id": {
      "type": "string",
      "format": "uuid",
      "description": "Unique identifier for this event."
    },
    "event_type": {
      "type": "string",
      "anyOf": [
        {
          "enum": [
            "PreToolUse",
            "PostToolUse",
            "UserPromptSubmit",
            "PreLLMCall",
            "PostLLMCall",
            "ModelResponse",
            "SessionStart",
            "SessionEnd",
            "AgentHandoff",
            "ErrorOccurred",
            "WebSearchRequested",
            "WebSearchResultsReturned",
            "WebResultSelected",
            "WebPageRead",
            "WebActionRequested",
            "WebActionCompleted",
            "EvidenceUsedInOutput",
            "ToolCallValidated",
            "ToolCallRedacted",
            "ToolCallRetried"
          ]
        },
        {
          "pattern": "^[A-Z][A-Za-z0-9]*$"
        }
      ],
      "description": "Canonical event type, or an additional PascalCase event type permitted by SPEC section 2."
    },
    "timestamp": {
      "type": "string",
      "format": "date-time",
      "description": "When the event was emitted, ISO 8601 UTC."
    },
    "source": {
      "type": "string",
      "description": "Publisher family, e.g. claude-code, amp, hermes, cursor, cody, openai-agents-sdk."
    },
    "agent_id": {
      "type": "string"
    },
    "session_id": {
      "type": "string"
    },
    "correlation_id": {
      "type": "string"
    },
    "evidence_phase": {
      "type": "string",
      "enum": [
        "pre_commit",
        "post_hoc",
        "observational"
      ],
      "description": "Evidence class for this event."
    },
    "tool_name": {
      "type": "string",
      "description": "Required for PreToolUse and PostToolUse."
    },
    "tool_input": {
      "type": "object",
      "additionalProperties": true
    },
    "action": {
      "type": "string",
      "description": "Publisher-agnostic operation being attempted, e.g. read, write, edit, execute, query, search, send, open, publish."
    },
    "resource_kind": {
      "type": "string",
      "description": "Publisher-agnostic resource class, e.g. file, directory, shell, database, url, email, repository, package."
    },
    "resource": {
      "description": "Canonical resource target for policy and audit. Use a string for simple targets or an object for composite targets.",
      "oneOf": [
        {
          "type": "string"
        },
        {
          "type": "object",
          "additionalProperties": true
        }
      ]
    },
    "resource_scope": {
      "type": "string",
      "description": "Scope of the target, e.g. local, workspace, remote, public_web, internal_network, tenant, production, unknown."
    },
    "operation_risk": {
      "type": "string",
      "description": "Advisory risk label for the attempted operation, e.g. sensitive_read, destructive_write, external_transfer, publication."
    },
    "metadata": {
      "type": "object",
      "additionalProperties": true
    },
    "annotations": {
      "type": "object",
      "additionalProperties": true
    }
  },
  "allOf": [
    {
      "if": {
        "properties": {
          "event_type": {
            "enum": ["PreToolUse", "PostToolUse"]
          }
        },
        "required": ["event_type"]
      },
      "then": {
        "required": ["tool_name"]
      }
    }
  ],
  "additionalProperties": false
}
