{
  "schema_version": 1,
  "event_id": "22222222-2222-4222-8222-222222222222",
  "event_type": "PostToolUse",
  "timestamp": "2026-06-06T12:00:02Z",
  "source": "example-runtime",
  "session_id": "sess-example-action-governance",
  "correlation_id": "11111111-1111-4111-8111-111111111111",
  "evidence_phase": "post_hoc",
  "tool_name": "send_email",
  "tool_input": {
    "to": "recipient@example.invalid",
    "subject": "Example notification",
    "body_ref": "evidence://redacted-inputs/call-email-001-body"
  },
  "action": "send",
  "resource_kind": "email",
  "resource": "recipient@example.invalid",
  "resource_scope": "remote",
  "operation_risk": "external_transfer",
  "metadata": {
    "tool_call_id": "call-email-001",
    "tool_input_executed": {
      "to": "recipient@example.invalid",
      "subject": "Example notification",
      "body_ref": "evidence://redacted-inputs/call-email-001-body"
    },
    "execution": {
      "started_at": "2026-06-06T12:00:01Z",
      "completed_at": "2026-06-06T12:00:02Z",
      "outcome": "succeeded",
      "duration_ms": 431,
      "result_ref": "evidence://tool-results/call-email-001",
      "result_hash": "sha256:2222222222222222222222222222222222222222222222222222222222222222"
    },
    "approval": {
      "status": "approved",
      "workflow_id": "approval-example-001",
      "decision_id": "decision-example-001"
    }
  }
}
